{"grids":{"gistemp_2deg":{"lon_order":"west_to_east","n_lat":90,"n_lon":180,"row_order":"north_to_south","scale":"percent of cell area (rounded)","values":[0,0,0,0,0,0,0,0,0,0,0,0,0,0,0,0,0,0,0,0,0,0,0,0,0,0,0,0,0,0,0,0,0,0,0,0,0,0,0,0,0,0,0,0,0,0,0,0,0,0,0,0,0,0,0,0,0,0,0,0,0,0,0,0,0,0,0,0,0,0,0,0,0,0,0,0,0,0,0,0,0,0,0,0,0,0,0,0,0,0,0,0,0,0,0,0,0,0,0,0,0,0,0,0,0,0,0,0,0,0,0,0,0,0,0,0,0,0,0,0,0,0,0,0,0,0,0,0,0,0,0,0,0,0,0,0,0,0,0,0,0,0,0,0,0,0,0,0,0,0,0,0,0,0,0,0,0,0,0,0,0,0,0,0,0,0,0,0,0,0,0,0,0,0,0,0,0,0,0,0,0,0,0,0,0,0,0,0,0,0,0,0,0,0,0,0,0,0,0,0,0,0,0,0,0,0,0,0,0,0,0,0,0,0,0,0,0,0,0,0,0,0,0,0,0,0,0,0,0,0,0,0,0,0,0,0,0,0,0,0,0,0,0,0,0,0,0,0,0,0,0,0,0,0,0,0,0,0,0,0,0,0,0,0,0,0,0,0,0,0,0,0,0,0,0,0,0,0,0,0,0,0,0,0,0,0,0,0,0,0,0,0,0,0,0,0,0,0,0,0,0,0,0,0,0,0,0,0,0,0,0,0,0,0,0,0,0,0,0,0,0,0,0,0,0,0,0,0,0,0,0,0,0,0,0,0,0,0,0,0,0,0,0,0,0,0,0,0,0,0,0,0,0,0,0,0,0,0,0,0,0,0,0,0,0,0,0,0,0,0,0,0,0,0,0,0,0,0,0,0,0,0,0,0,0,0,0,0,0,0,0,0,0,0,0,0,0,0,0,0,0,0,0,0,0,0,0,0,0,0,0,0,0,0,0,0,0,0,0,0,0,0,0,0,0,0,0,0,0,0,0,0,0,0,0,0,0,0,0,0,0,0,0,0,0,0,0,0,0,0,0,0,0,0,0,0,0,0,0,0,0,0,0,0,0,0,0,0,0,0,0,0,0,0,0,0,0,0,0,0,0,0,0,0,0,0,0,0,0,0,0,0,0,0,0,0,0,0,0,0,0,0,0,0,0,0,0,0,0,0,0,0,0,0,0,0,0,0,0,0,0,0,0,0,0,0,0,0,0,0,0,0,0,0,0,0,0,0,0,0,0,0,0,0,0,0,0,0,0,0,0,0,0,0,0,0,0,0,0,0,0,0,0,0,0,0,0,0,0,0,0,0,0,0,0,0,0,0,0,0,0,0,0,0,0,5,16,30,28,50,59,62,55,62,62,55,50,50,33,2,3,12,12,2,17,9,12,45,62,62,70,75,86,77,64,62,64,50,34,5,0,0,0,0,0,0,0,0,0,0,0,0,0,0,0,0,0,0,0,0,0,0,0,0,0,0,0,0,0,0,0,0,0,0,0,0,0,0,0,0,0,0,0,0,0,0,0,0,0,0,0,0,0,0,0,0,0,0,0,0,0,0,0,0,0,0,0,0,0,0,0,0,0,0,0,0,0,0,0,0,0,0,0,0,0,0,0,0,0,0,0,0,0,0,0,0,0,0,0,0,0,0,0,0,0,0,0,0,0,0,0,0,0,0,0,0,0,0,0,0,0,0,0,0,0,0,0,0,0,0,0,0,0,0,0,0,0,0,0,0,0,6,50,62,62,84,83,88,88,100,100,100,100,100,97,66,61,53,67,98,100,100,100,100,100,100,100,97,100,100,100,100,100,100,100,100,100,92,91,73,83,73,52,23,0,0,0,0,0,0,0,0,0,0,0,0,0,0,2,25,23,28,23,6,0,0,0,0,0,0,0,0,5,27,23,9,0,0,0,0,0,0,0,0,0,0,0,0,0,0,0,0,0,0,0,5,38,58,50,14,0,0,0,0,0,0,0,0,0,0,0,0,0,0,0,0,0,0,0,0,0,0,0,0,0,0,0,0,0,0,0,0,0,0,0,0,0,0,0,0,0,0,0,0,0,0,0,0,0,0,0,0,0,0,0,0,0,0,0,0,0,0,0,0,0,0,0,0,0,0,0,0,0,2,17,2,0,25,42,34,9,38,33,73,88,81,62,91,100,100,100,95,34,33,42,48,62,95,100,100,100,100,100,100,100,100,100,100,100,100,100,100,100,100,100,100,100,100,100,100,39,0,0,0,0,0,0,0,0,0,0,0,0,0,0,30,88,92,98,69,42,39,25,8,0,0,0,0,0,0,0,0,0,0,0,0,0,0,0,0,0,0,0,0,0,0,0,0,0,0,0,0,0,0,0,0,17,47,59,62,50,50,20,0,0,0,0,0,0,0,0,0,0,0,0,0,0,0,0,0,0,0,0,0,0,0,0,0,0,0,0,0,0,0,0,0,0,0,0,0,0,0,0,0,0,0,0,0,0,0,0,0,0,0,0,0,0,0,0,0,0,0,0,0,0,0,0,0,6,44,59,44,20,23,23,31,0,0,3,20,30,20,45,36,19,22,75,80,78,88,55,0,0,2,28,78,89,88,88,100,100,100,100,100,100,100,100,100,100,100,100,100,100,100,100,100,100,100,100,81,16,0,0,0,0,0,0,0,0,0,0,0,0,0,0,0,2,45,47,3,11,22,3,0,0,0,0,0,0,0,0,0,0,0,0,0,0,0,0,0,9,17,30,39,9,0,0,0,0,0,0,0,0,0,0,0,0,3,3,22,39,72,72,41,38,34,14,0,0,0,0,0,0,0,0,0,0,0,0,5,0,0,0,0,0,0,0,0,0,0,0,0,0,0,0,0,0,0,0,0,0,0,0,0,0,0,0,0,0,0,0,0,0,0,0,0,0,0,0,0,0,0,0,0,0,0,0,5,20,19,12,33,50,61,52,48,48,5,6,33,50,11,45,25,67,55,50,58,62,50,0,0,0,0,0,0,0,0,0,2,25,80,100,100,100,100,100,100,100,100,100,100,100,100,100,100,100,100,100,88,9,0,0,0,0,0,0,0,0,0,0,0,0,0,0,0,0,0,0,0,0,0,0,0,0,0,0,0,0,0,0,0,0,0,0,0,0,17,69,70,47,27,9,0,0,0,0,0,0,0,0,0,0,42,67,86,94,100,100,100,100,100,100,100,100,67,45,0,0,0,0,0,0,0,0,0,0,0,17,61,62,56,16,23,25,2,0,0,0,0,0,0,0,0,0,0,0,0,0,0,0,0,0,0,0,0,0,0,0,0,0,0,0,0,0,0,0,0,0,0,0,0,0,0,0,0,0,42,100,100,81,84,58,42,33,28,62,38,3,61,88,38,89,64,22,61,78,56,81,53,66,53,5,0,0,0,0,0,0,0,0,3,72,100,100,100,100,100,100,100,100,100,100,100,100,100,100,95,69,22,0,0,0,0,0,0,0,0,0,0,0,0,0,0,0,0,0,0,0,0,0,0,0,0,0,0,0,0,0,0,0,0,0,0,0,0,47,89,33,0,0,0,0,0,27,47,14,12,6,12,62,88,89,100,100,100,100,100,100,100,100,100,100,100,100,97,86,86,88,62,50,64,78,72,23,0,0,0,0,11,59,50,25,19,9,0,0,0,0,0,0,0,0,0,0,0,0,0,0,0,31,2,0,0,0,0,0,0,2,23,39,58,52,39,25,20,12,2,2,0,0,0,0,0,2,5,9,17,44,30,19,72,88,91,100,98,100,81,28,8,31,31,89,66,3,59,88,100,100,100,98,100,95,73,47,25,0,0,0,0,0,0,33,80,98,100,100,100,100,100,100,100,100,100,100,100,100,69,75,2,0,0,0,0,0,0,0,0,0,0,0,0,0,0,0,0,0,0,0,0,8,19,48,53,50,9,0,0,0,0,0,0,0,0,0,6,42,56,11,0,0,0,0,36,97,100,34,83,98,100,98,100,100,100,100,100,100,100,100,100,100,100,100,100,100,100,100,100,100,100,100,100,100,100,83,53,81,78,73,80,100,100,100,100,100,72,44,50,50,38,0,0,0,0,0,0,0,0,0,19,33,5,0,0,0,0,9,48,81,100,100,100,100,100,100,100,100,100,98,86,70,50,72,78,98,97,97,88,81,83,61,62,73,70,66,67,81,66,56,12,36,64,39,100,66,47,2,73,94,30,5,33,75,97,100,95,25,0,0,0,0,0,9,44,78,100,100,100,100,100,100,100,100,100,95,84,66,36,5,0,0,0,0,0,0,0,0,0,0,0,0,0,0,0,0,0,0,3,42,84,100,100,100,100,100,89,80,61,45,16,0,2,20,3,0,9,31,17,25,31,70,80,59,38,81,100,56,83,100,100,100,100,100,100,100,100,100,100,100,100,100,100,100,100,100,100,100,100,100,100,100,100,100,100,100,100,100,100,100,100,100,100,100,100,100,100,100,100,100,98,77,86,78,75,52,91,94,88,83,64,100,95,53,50,25,0,3,31,59,98,100,100,100,100,100,100,100,100,100,100,100,100,100,100,100,100,100,100,100,100,100,100,94,88,91,83,98,100,98,88,91,98,97,100,100,98,78,83,72,14,0,25,17,61,100,100,89,91,48,0,0,0,0,78,100,100,100,100,100,100,100,100,78,23,0,0,0,0,14,3,6,14,17,0,0,0,0,0,0,0,0,0,0,0,0,0,22,89,100,100,100,100,100,100,100,100,94,72,88,95,39,20,84,45,86,100,100,100,100,100,100,100,100,100,100,94,47,88,100,100,100,100,100,100,100,100,100,100,100,100,100,100,100,100,100,100,100,100,100,100,100,100,100,100,100,100,100,100,100,100,100,100,100,100,100,100,100,100,100,100,100,100,100,100,100,100,100,100,100,100,16,27,66,70,19,0,41,75,75,84,100,100,100,100,100,100,100,100,100,100,100,100,100,100,100,100,100,100,100,100,100,100,100,100,100,100,100,100,100,100,100,100,100,100,100,97,48,73,41,5,5,50,53,95,100,100,56,41,22,0,0,0,0,23,100,100,100,100,100,81,20,3,0,0,0,0,0,2,48,94,100,100,70,3,0,0,0,0,0,0,0,0,0,0,2,44,98,100,100,100,72,16,69,100,100,100,100,52,30,36,94,100,100,100,100,100,100,100,100,100,100,100,100,100,100,100,100,100,100,100,100,100,100,100,100,100,100,100,100,100,100,100,100,100,100,100,100,100,100,100,100,100,100,100,100,100,100,100,100,100,100,100,100,100,100,100,100,100,100,100,100,100,100,100,100,100,100,100,98,69,0,0,0,0,19,11,0,33,64,86,100,100,100,100,100,100,100,100,100,100,100,100,100,100,100,100,100,100,100,100,100,100,100,100,100,100,100,100,100,100,100,100,100,88,38,0,11,31,38,20,6,23,12,12,53,80,69,36,0,0,0,0,0,0,41,98,100,100,84,16,0,0,0,0,0,0,0,0,0,12,23,6,0,0,0,0,0,0,0,0,0,0,8,48,84,100,100,100,94,38,27,95,100,100,100,100,100,100,100,100,100,100,100,100,100,100,100,100,100,100,100,100,100,100,100,100,100,100,100,100,100,100,100,100,100,100,100,100,100,100,100,100,100,100,100,100,100,100,100,100,100,100,100,100,100,100,100,100,100,100,100,100,100,100,100,100,100,100,100,100,100,89,97,100,100,100,100,100,80,44,0,0,0,0,0,0,8,72,100,100,100,100,100,95,86,97,64,88,100,100,100,100,100,100,100,100,100,100,100,100,100,100,100,100,100,100,100,100,100,100,100,100,89,9,0,0,0,0,0,2,3,89,100,97,59,12,0,3,0,0,0,0,0,0,0,33,62,89,56,0,0,0,0,0,0,0,0,0,0,0,0,0,0,0,0,0,0,0,0,0,0,0,44,100,100,100,100,100,78,6,20,95,92,75,92,100,100,100,100,100,100,100,100,100,100,100,100,100,100,100,100,100,100,100,100,100,100,100,100,100,100,100,100,100,100,100,100,100,100,100,100,100,100,100,100,100,100,100,100,100,100,100,100,100,100,100,100,100,100,100,100,100,100,100,100,100,100,84,31,22,58,52,98,97,83,80,31,6,0,0,0,0,0,0,0,0,3,2,6,59,66,88,98,19,30,8,0,0,0,11,44,83,88,100,100,100,100,100,100,100,100,100,100,100,100,100,100,100,100,100,100,100,81,17,0,0,0,0,0,0,6,86,100,100,100,58,25,89,33,0,0,0,0,0,0,0,0,0,0,0,0,0,0,0,0,0,0,0,0,0,0,0,0,0,0,0,0,17,9,0,0,0,20,88,66,62,100,100,73,8,0,14,70,75,94,100,100,100,100,100,100,100,100,100,100,100,100,100,100,100,100,100,100,100,100,100,100,100,100,100,100,100,100,100,100,100,100,100,100,100,100,100,100,100,100,100,100,100,100,100,100,100,100,100,100,100,100,100,100,100,83,45,38,38,30,39,55,16,0,25,88,45,8,2,0,0,0,0,0,0,0,0,0,0,0,0,0,0,0,3,42,52,19,34,0,0,0,0,0,0,0,0,0,58,100,100,100,100,100,100,100,100,100,100,100,100,100,100,100,100,100,100,100,86,61,39,3,0,0,0,0,38,100,100,100,100,100,100,98,17,0,0,0,0,0,0,0,0,0,0,0,0,0,0,0,0,0,0,0,0,0,0,0,0,0,0,0,94,69,0,0,0,0,0,56,25,88,94,17,0,31,67,94,100,100,100,100,100,100,100,100,100,100,100,100,100,100,100,100,100,100,100,100,100,100,100,100,100,100,100,100,100,100,100,100,100,100,100,100,100,100,100,100,100,100,100,100,100,100,100,100,100,100,100,100,100,100,100,95,44,2,0,0,0,0,0,0,5,81,100,100,44,0,0,0,0,0,0,0,0,0,0,0,0,0,0,0,6,28,27,11,0,0,0,0,0,0,0,0,0,0,0,0,2,55,100,100,100,100,100,100,100,100,100,100,100,100,100,100,100,100,100,100,100,100,100,95,69,52,0,34,89,100,100,100,100,100,100,100,94,58,17,0,0,0,0,0,0,0,0,0,0,0,0,0,0,0,0,0,0,0,0,0,0,0,16,53,36,88,38,0,0,0,0,77,36,44,11,33,31,72,100,100,100,100,100,100,100,100,100,100,100,100,100,100,100,100,100,100,100,100,100,100,100,100,100,100,100,100,100,100,100,100,100,100,100,100,100,100,100,100,100,100,100,100,100,100,100,100,100,100,100,100,100,100,100,100,94,27,8,0,3,0,0,0,0,0,22,100,100,72,0,0,0,0,0,0,0,0,0,0,0,0,0,0,0,0,0,0,0,0,0,0,0,0,0,0,0,0,0,0,0,0,28,5,48,100,100,100,100,100,100,100,100,100,100,100,100,100,100,100,100,100,100,100,100,100,100,95,11,39,100,100,100,100,100,100,100,100,100,100,92,9,0,0,0,0,0,0,0,0,0,0,0,0,0,0,0,0,0,0,0,0,0,0,73,80,22,88,100,38,0,50,81,95,100,100,97,100,100,100,100,100,100,100,100,100,100,100,100,100,100,100,100,100,100,100,100,100,100,100,100,100,100,100,100,100,100,100,100,100,100,100,100,100,100,100,100,100,100,100,100,100,100,100,100,100,100,100,100,100,100,100,100,100,100,100,100,98,98,64,50,0,0,0,0,0,3,95,56,3,0,0,0,0,0,0,0,0,0,0,0,0,0,0,0,0,0,0,0,0,0,0,0,0,0,0,0,0,0,0,0,0,0,0,6,81,95,100,100,100,100,100,100,100,100,100,100,100,100,100,100,100,100,100,100,100,100,100,89,84,100,100,100,100,100,97,88,89,92,58,66,6,0,0,0,0,0,0,0,0,0,0,0,0,0,0,0,0,0,0,0,0,0,0,12,0,44,75,64,52,66,100,100,100,100,100,100,100,100,100,100,100,100,100,100,100,100,100,100,100,100,100,100,100,100,100,100,100,10